{
  "$schema": "../schemas/dependency-policy.schema.json",
  "schemaVersion": 1,
  "failOnSeverity": "high",
  "deniedLicenses": [
    "AGPL-3.0",
    "AGPL-3.0-only",
    "AGPL-3.0-or-later",
    "GPL-2.0",
    "GPL-2.0-only",
    "GPL-2.0-or-later",
    "GPL-3.0",
    "GPL-3.0-only",
    "GPL-3.0-or-later"
  ],
  "commentSummaryInPr": "never",
  "auditExceptions": [],
  "distributedNodeRuntimeDependencies": false
}
